{"after_digest": {"algorithm": "sha256", "encoding": "hex", "value": "2e1418c946c116b002a921a591f5324c4fd30390e1b71eef2f610ca4234f598e"}, "before_digest": {"algorithm": "sha256", "encoding": "hex", "value": "2e1418c946c116b002a921a591f5324c4fd30390e1b71eef2f610ca4234f598e"}, "guard_result_id": "rootguard_cbc23f010a624a2e90d65405e5f86336", "issued_at": "2026-10-05T13:49:46.369267Z", "result": "PASS", "schema_version": "2.0.0", "task_ref": "F00-governance-bootstrap", "unauthorized_entries": []}
